Sheet: APAgingSummary
A1: Masterworks Administrative Services, LLC
A2: Consolidated Masterworks Total Entities : Masterworks, LLC (Consolidated)
A3: A/P Aging Summary
A4: As of August 31, 2024
A7: Vendor | B7: Current | C7: 2024-08-02 - 2024-08-31 (30) | D7: 2024-07-03 - 2024-08-01 (60) | E7: 2024-06-03 - 2024-07-02 (90) | F7: Before 2024-06-03 (>90) | G7: Total
A8: Â | B8: Open Balance | C8: Open Balance | D8: Open Balance | E8: Open Balance | F8: Open Balance | G8: Open Balance
A9: - No Vendor - | B9: 0.0 | C9: 0.0 | D9: 0.0 | E9: 0.0 | F9: 1.3432898566E8 | G9: SUM(RC[-5]:RC[-1]) -> 1.3432898566E8
A10: Vendor
A11: 30 East Realty LLC | B11: 29870.0 | C11: 0.0 | D11: 0.0 | E11: 0.0 | F11: 0.0 | G11: SUM(RC[-5]:RC[-1]) -> 29870.0
A12: ABM | B12: 1823.76 | C12: 1823.76 | D12: 0.0 | E12: 0.0 | F12: 0.0 | G12: SUM(RC[-5]:RC[-1]) -> 3647.52
A13: Adis Sahmanovic | B13: 0.0 | C13: 517.15 | D13: 0.0 | E13: 0.0 | F13: 0.0 | G13: SUM(RC[-5]:RC[-1]) -> 517.15
A14: Ahmet Yavuz Besiroglu | B14: 0.0 | C14: 2400.0 | D14: 0.0 | E14: 0.0 | F14: 0.0 | G14: SUM(RC[-5]:RC[-1]) -> 2400.0
A15: Aidentified LLC | B15: 27500.0 | C15: 0.0 | D15: 0.0 | E15: 0.0 | F15: 0.0 | G15: SUM(RC[-5]:RC[-1]) -> 27500.0
A16: Air Force Mechanical, Corp | B16: 1568.93 | C16: 0.0 | D16: 0.0 | E16: 0.0 | F16: 0.0 | G16: SUM(RC[-5]:RC[-1]) -> 1568.93
A17: Aircall.io, Inc | B17: 7459.55 | C17: 0.0 | D17: 0.0 | E17: 0.0 | F17: 0.0 | G17: SUM(RC[-5]:RC[-1]) -> 7459.55
A18: ALUX, Inc. | B18: 4000.0 | C18: 9000.0 | D18: 0.0 | E18: 0.0 | F18: 0.0 | G18: SUM(RC[-5]:RC[-1]) -> 13000.0
A19: Appleby Global Services Cayman Limited | B19: 2451.4 | C19: 0.0 | D19: 4018.55 | E19: 0.0 | F19: 0.0 | G19: SUM(RC[-5]:RC[-1]) -> 6469.950000000001
A20: Arete Wealth, Inc. | B20: 0.0 | C20: 8538.54 | D20: 0.0 | E20: 0.0 | F20: 0.0 | G20: SUM(RC[-5]:RC[-1]) -> 8538.54
A21: Art Crating Inc. | B21: 0.0 | C21: 1851.69 | D21: 0.0 | E21: 0.0 | F21: 0.0 | G21: SUM(RC[-5]:RC[-1]) -> 1851.69
A22: AudiencePoint Inc | B22: 7000.0 | C22: 0.0 | D22: 0.0 | E22: 0.0 | F22: 0.0 | G22: SUM(RC[-5]:RC[-1]) -> 7000.0
A23: Barrington Media Group LLC | B23: 0.0 | C23: 12817.25 | D23: 0.0 | E23: 0.0 | F23: 0.0 | G23: SUM(RC[-5]:RC[-1]) -> 12817.25
A24: Become Group SC | B24: 0.0 | C24: 3500.0 | D24: 0.0 | E24: 0.0 | F24: 0.0 | G24: SUM(RC[-5]:RC[-1]) -> 3500.0
A25: BEN HAMOU BENCHETRIT LAW GROUP | B25: 0.0 | C25: 8054.0 | D25: 0.0 | E25: 0.0 | F25: 0.0 | G25: SUM(RC[-5]:RC[-1]) -> 8054.0
A26: Citrin Cooperman & Company, LLP | B26: 29400.0 | C26: 0.0 | D26: 0.0 | E26: 0.0 | F26: 0.0 | G26: SUM(RC[-5]:RC[-1]) -> 29400.0
A27: Clevertech Partners LLC | B27: 159000.0 | C27: 0.0 | D27: 0.0 | E27: 0.0 | F27: 0.0 | G27: SUM(RC[-5]:RC[-1]) -> 159000.0
A28: Corey DAugustine Conservation | B28: 0.0 | C28: 800.0 | D28: 0.0 | E28: 0.0 | F28: 0.0 | G28: SUM(RC[-5]:RC[-1]) -> 800.0
A29: Corporate Essentials | B29: 460.54 | C29: 0.0 | D29: 0.0 | E29: 0.0 | F29: 0.0 | G29: SUM(RC[-5]:RC[-1]) -> 460.54
A30: Delaware Freeport LLC | B30: 8802.48 | C30: 0.0 | D30: 0.0 | E30: 0.0 | F30: 0.0 | G30: SUM(RC[-5]:RC[-1]) -> 8802.48
A31: Delaware National Art Company LLC | B31: 1584.63 | C31: 7900.19 | D31: 0.0 | E31: 0.0 | F31: 0.0 | G31: SUM(RC[-5]:RC[-1]) -> 9484.82
A32: Dwolla | B32: 0.0 | C32: 4500.0 | D32: 0.0 | E32: 0.0 | F32: 0.0 | G32: SUM(RC[-5]:RC[-1]) -> 4500.0
A33: Elephant Ventures | B33: 9500.0 | C33: 0.0 | D33: 0.0 | E33: 0.0 | F33: 0.0 | G33: SUM(RC[-5]:RC[-1]) -> 9500.0
A34: Ericnomics LLC | B34: 0.0 | C34: 2500.0 | D34: 0.0 | E34: 0.0 | F34: 0.0 | G34: SUM(RC[-5]:RC[-1]) -> 2500.0
A35: Faved LTD | B35: 500.0 | C35: 0.0 | D35: 0.0 | E35: 0.0 | F35: 0.0 | G35: SUM(RC[-5]:RC[-1]) -> 500.0
A36: FINRA | B36: 0.0 | C36: 0.0 | D36: 0.0 | E36: 0.0 | F36: 4093.35 | G36: SUM(RC[-5]:RC[-1]) -> 4093.35
A37: Gabriel Bult | B37: 5500.0 | C37: 0.0 | D37: 0.0 | E37: 0.0 | F37: 0.0 | G37: SUM(RC[-5]:RC[-1]) -> 5500.0
A38: Going | B38: 0.0 | C38: 6000.0 | D38: 0.0 | E38: 0.0 | F38: 0.0 | G38: SUM(RC[-5]:RC[-1]) -> 6000.0
A39: Google | B39: 5652.08 | C39: 0.0 | D39: 0.0 | E39: 0.0 | F39: 0.0 | G39: SUM(RC[-5]:RC[-1]) -> 5652.08
A40: Gorvy Levy LLC | B40: 0.0 | C40: 0.0 | D40: 0.0 | E40: 0.0 | F40: 16331.25 | G40: SUM(RC[-5]:RC[-1]) -> 16331.25
A41: GUARDD, Inc. | B41: 4000.0 | C41: 92750.0 | D41: 0.0 | E41: 0.0 | F41: 0.0 | G41: SUM(RC[-5]:RC[-1]) -> 96750.0
A42: Haynes and Boone, LLP | B42: 0.0 | C42: 0.0 | D42: 11720.0 | E42: 0.0 | F42: 0.0 | G42: SUM(RC[-5]:RC[-1]) -> 11720.0
A43: Howard Media LLC | B43: 0.0 | C43: 0.0 | D43: -2000.0 | E43: 0.0 | F43: 2000.0 | G43: SUM(RC[-5]:RC[-1]) -> 0.0
A44: IC - Level & Co Gallery, LLC | B44: 0.0 | C44: 175000.0 | D44: 3953.12 | E44: 6883000.0 | F44: 2884241.91 | G44: SUM(RC[-5]:RC[-1]) -> 9946195.030000001
A45: IC - Masterworks Administrative Services, LLC (LP) | B45: 0.0 | C45: 2232466.35 | D45: 1200877.9 | E45: 353833.33 | F45: 1.070371631E7 | G45: SUM(RC[-5]:RC[-1]) -> 1.449089389E7
A46: IC - Masterworks Advisers, LLC | B46: 0.0 | C46: 525965.83 | D46: 530869.52 | E46: 672463.77 | F46: 4648823.6 | G46: SUM(RC[-5]:RC[-1]) -> 6378122.72
A47: IC - Masterworks Executive Services, LLC | B47: 0.0 | C47: 139394.15 | D47: 176144.02 | E47: 181440.72 | F47: 2568532.99 | G47: SUM(RC[-5]:RC[-1]) -> 3065511.8800000004
A48: IC - Masterworks Foundry, LLC | B48: 0.0 | C48: 0.0 | D48: 422176.21 | E48: 460000.0 | F48: 89831.48 | G48: SUM(RC[-5]:RC[-1]) -> 972007.69
A49: IC - Masterworks Gallery, LLC | B49: 0.0 | C49: 1570000.0 | D49: 3664692.18 | E49: 2981000.0 | F49: 1.3089298274E8 | G49: SUM(RC[-5]:RC[-1]) -> 1.3910867492E8
A50: IC - Masterworks Investor Services, LLC | B50: 0.0 | C50: 25044.22 | D50: 454177.47 | E50: 434727.08 | F50: 4723583.69 | G50: SUM(RC[-5]:RC[-1]) -> 5637532.460000001
A51: IC - Masterworks, LLC | B51: 0.0 | C51: 0.0 | D51: 739294.6 | E51: 2.724053906E7 | F51: 5.316741358E7 | G51: SUM(RC[-5]:RC[-1]) -> 8.114724724E7
A52: IC - MWG Cayman Entity | B52: 0.0 | C52: 145000.0 | D52: 477025.0 | E52: 659010.52 | F52: 4.831095782E7 | G52: SUM(RC[-5]:RC[-1]) -> 4.959199334E7
A53: IC - Sierra 1 LLC | B53: 0.0 | C53: 0.0 | D53: 0.0 | E53: 6253859.59 | F53: 8898164.39 | G53: SUM(RC[-5]:RC[-1]) -> 1.515202398E7
A54: Impact Tech, Inc. | B54: 18925.5 | C54: 0.0 | D54: 0.0 | E54: 0.0 | F54: 0.0 | G54: SUM(RC[-5]:RC[-1]) -> 18925.5
A55: Influint | B55: 4500.0 | C55: 0.0 | D55: 0.0 | E55: 0.0 | F55: 0.0 | G55: SUM(RC[-5]:RC[-1]) -> 4500.0
A56: Jay Grimm | B56: 762.5 | C56: 0.0 | D56: 0.0 | E56: 0.0 | F56: 0.0 | G56: SUM(RC[-5]:RC[-1]) -> 762.5
A57: Jellyfish US Limited | B57: 0.0 | C57: 0.0 | D57: 0.0 | E57: 3395.21 | F57: 6798.75 | G57: SUM(RC[-5]:RC[-1]) -> 10193.96
A58: Jennifer Yum Ramp | B58: 0.0 | C58: 0.0 | D58: 0.0 | E58: 39.82 | F58: 0.0 | G58: SUM(RC[-5]:RC[-1]) -> 39.82
A59: Julia Nagle Conservation LTD | B59: 1037.97 | C59: 0.0 | D59: 0.0 | E59: 0.0 | F59: 0.0 | G59: SUM(RC[-5]:RC[-1]) -> 1037.97
A60: Julian Amaya | B60: 2500.0 | C60: 0.0 | D60: 0.0 | E60: 0.0 | F60: 0.0 | G60: SUM(RC[-5]:RC[-1]) -> 2500.0
A61: K&L Gates LLP | B61: 0.0 | C61: 3875.7 | D61: 29807.25 | E61: 0.0 | F61: 0.0 | G61: SUM(RC[-5]:RC[-1]) -> 33682.95
A62: Lakeshore IT Solutions | B62: 15009.2 | C62: 32153.34 | D62: 0.0 | E62: 0.0 | F62: -686.52 | G62: SUM(RC[-5]:RC[-1]) -> 46476.020000000004
A63: LexisNexis | B63: 827.46 | C63: 0.0 | D63: 0.0 | E63: 0.0 | F63: 0.0 | G63: SUM(RC[-5]:RC[-1]) -> 827.46
A64: LinkedIn Corporation | B64: 0.0 | C64: 27004.53 | D64: 0.0 | E64: 0.0 | F64: 0.0 | G64: SUM(RC[-5]:RC[-1]) -> 27004.53
A65: Liverpool Carting Co., Inc. | B65: 326.63 | C65: 0.0 | D65: 0.0 | E65: 0.0 | F65: 0.0 | G65: SUM(RC[-5]:RC[-1]) -> 326.63
A66: Mailgun Technologies, Inc. | B66: 0.0 | C66: 256.94 | D66: 0.0 | E66: 0.0 | F66: 0.0 | G66: SUM(RC[-5]:RC[-1]) -> 256.94
A67: Mango Technologies, Inc. | B67: 9720.36 | C67: 0.0 | D67: 0.0 | E67: 0.0 | F67: 0.0 | G67: SUM(RC[-5]:RC[-1]) -> 9720.36
A68: Media Intercept Inc | B68: 0.0 | C68: 13405.0 | D68: 0.0 | E68: 0.0 | F68: 0.0 | G68: SUM(RC[-5]:RC[-1]) -> 13405.0
A69: Nano Zebra Corp | B69: 3000.0 | C69: 0.0 | D69: 0.0 | E69: 0.0 | F69: 0.0 | G69: SUM(RC[-5]:RC[-1]) -> 3000.0
A70: Naoyoshi Mori | B70: 0.0 | C70: 0.0 | D70: -998.0 | E70: 0.0 | F70: 998.0 | G70: SUM(RC[-5]:RC[-1]) -> 0.0
A71: Onfido, Inc. | B71: 0.0 | C71: 3674.54 | D71: 0.0 | E71: 0.0 | F71: 0.0 | G71: SUM(RC[-5]:RC[-1]) -> 3674.54
A72: Pest Control Office Ltd | B72: 0.0 | C72: 59.85 | D72: 0.0 | E72: 0.0 | F72: 0.0 | G72: SUM(RC[-5]:RC[-1]) -> 59.85
A73: Plaid | B73: 859.45 | C73: 0.0 | D73: 0.0 | E73: 0.0 | F73: 0.0 | G73: SUM(RC[-5]:RC[-1]) -> 859.45
A74: Plaid Financial Ltd. | B74: 658.96 | C74: 0.0 | D74: 640.88 | E74: 0.0 | F74: -640.88 | G74: SUM(RC[-5]:RC[-1]) -> 658.9600000000002
A75: Quantum Leading, Inc. | B75: 0.0 | C75: 0.0 | D75: 5000.0 | E75: 0.0 | F75: 0.0 | G75: SUM(RC[-5]:RC[-1]) -> 5000.0
A76: RocÃ­o Cleaning Service | B76: 1400.0 | C76: 0.0 | D76: 0.0 | E76: 0.0 | F76: 0.0 | G76: SUM(RC[-5]:RC[-1]) -> 1400.0
A77: Ropes & Gray LLP | B77: 4730.0 | C77: 0.0 | D77: 0.0 | E77: 0.0 | F77: 0.0 | G77: SUM(RC[-5]:RC[-1]) -> 4730.0
A78: SiriusXM | B78: 0.0 | C78: 0.0 | D78: 0.0 | E78: 0.0 | F78: 3000.0 | G78: SUM(RC[-5]:RC[-1]) -> 3000.0
A79: Stoic Media LTD | B79: 0.0 | C79: 1000.0 | D79: 0.0 | E79: 0.0 | F79: 0.0 | G79: SUM(RC[-5]:RC[-1]) -> 1000.0
A80: Striano Electric | B80: 4071.93 | C80: 0.0 | D80: 0.0 | E80: 0.0 | F80: 0.0 | G80: SUM(RC[-5]:RC[-1]) -> 4071.93
A81: TabaPay | B81: 792.1 | C81: 0.0 | D81: 0.0 | E81: 0.0 | F81: 69675.61 | G81: SUM(RC[-5]:RC[-1]) -> 70467.71
A82: Till Musshoff | B82: 0.0 | C82: 0.0 | D82: -2.7 | E82: 2.7 | F82: 0.0 | G82: SUM(RC[-5]:RC[-1]) -> 0.0
A83: Tinuiti, Inc. | B83: 0.0 | C83: 0.0 | D83: 50000.0 | E83: 0.0 | F83: 0.0 | G83: SUM(RC[-5]:RC[-1]) -> 50000.0
A84: TriplePoint Capital LLC | B84: 0.0 | C84: 99027.78 | D84: 0.0 | E84: 0.0 | F84: 0.0 | G84: SUM(RC[-5]:RC[-1]) -> 99027.78
A85: Twilio | B85: 12414.13 | C85: 0.0 | D85: 0.0 | E85: 0.0 | F85: 0.0 | G85: SUM(RC[-5]:RC[-1]) -> 12414.13
A86: UOVO LLC | B86: 7298.1 | C86: 0.0 | D86: 0.0 | E86: 0.0 | F86: 281.72 | G86: SUM(RC[-5]:RC[-1]) -> 7579.820000000001
A87: Valerie Faivre Paper Conservation, LLC | B87: 625.0 | C87: 0.0 | D87: 0.0 | E87: 0.0 | F87: 0.0 | G87: SUM(RC[-5]:RC[-1]) -> 625.0
A88: Validity Inc | B88: 9542.38 | C88: 0.0 | D88: 0.0 | E88: 0.0 | F88: 0.0 | G88: SUM(RC[-5]:RC[-1]) -> 9542.38
A89: VPS Services, LLC | B89: 3500.0 | C89: 5995.06 | D89: 0.0 | E89: 0.0 | F89: 0.0 | G89: SUM(RC[-5]:RC[-1]) -> 9495.060000000001
A90: WFP TOWER B CO. L.P. | B90: 251585.83 | C90: 0.0 | D90: 0.0 | E90: 0.0 | F90: 0.0 | G90: SUM(RC[-5]:RC[-1]) -> 251585.83
A91: Williams & Hill Forwarding Ltd | B91: 0.0 | C91: 416.53 | D91: 0.0 | E91: 0.0 | F91: 0.0 | G91: SUM(RC[-5]:RC[-1]) -> 416.53
A92: Total - Vendor | B92: SUM(R[-81]C:R[-1]C) -> 660160.87 | C92: SUM(R[-81]C:R[-1]C) -> 5162692.4 | D92: SUM(R[-81]C:R[-1]C) -> 7767395.999999999 | E92: SUM(R[-81]C:R[-1]C) -> 4.612331180000001E7 | F92: SUM(R[-81]C:R[-1]C) -> 2.6699009978999996E8 | G92: SUM(R[-81]C:R[-1]C) -> 3.2670366085999995E8
A93: Total | B93: SUM(R[-84]C,R[-1]C) -> 660160.87 | C93: SUM(R[-84]C,R[-1]C) -> 5162692.4 | D93: SUM(R[-84]C,R[-1]C) -> 7767395.999999999 | E93: SUM(R[-84]C,R[-1]C) -> 4.612331180000001E7 | F93: SUM(R[-84]C,R[-1]C) -> 4.013190854499999E8 | G93: SUM(R[-84]C,R[-1]C) -> 4.610326465199999E8