Sheet: APAgingSummary
A1: Masterworks Administrative Services, LLC
A2: Consolidated Masterworks Total Entities : Masterworks, LLC : Masterworks Administrative Services, LLC (LP)
A3: A/P Aging Summary
A4: As of August 31, 2024
A7: Vendor | B7: Current | C7: 2024-08-19 - 2024-09-17 (30) | D7: 2024-07-20 - 2024-08-18 (60) | E7: 2024-06-20 - 2024-07-19 (90) | F7: Before 2024-06-20 (>90) | G7: Total
A8: Â | B8: Open Balance | C8: Open Balance | D8: Open Balance | E8: Open Balance | F8: Open Balance | G8: Open Balance
A9: - No Vendor - | B9: 0.0 | C9: 0.0 | D9: 0.0 | E9: 0.0 | F9: 8.824037113E7 | G9: SUM(RC[-5]:RC[-1]) -> 8.824037113E7
A10: Vendor
A11: ABM | B11: 1823.76 | C11: 1823.76 | D11: 0.0 | E11: 0.0 | F11: 0.0 | G11: SUM(RC[-5]:RC[-1]) -> 3647.52
A12: Ahmet Yavuz Besiroglu | B12: 0.0 | C12: 2400.0 | D12: 0.0 | E12: 0.0 | F12: 0.0 | G12: SUM(RC[-5]:RC[-1]) -> 2400.0
A13: Aidentified LLC | B13: 27500.0 | C13: 0.0 | D13: 0.0 | E13: 0.0 | F13: 0.0 | G13: SUM(RC[-5]:RC[-1]) -> 27500.0
A14: Aircall.io, Inc | B14: 2701.56 | C14: 0.0 | D14: 0.0 | E14: 0.0 | F14: 0.0 | G14: SUM(RC[-5]:RC[-1]) -> 2701.56
A15: ALUX, Inc. | B15: 0.0 | C15: 13000.0 | D15: 0.0 | E15: 0.0 | F15: 0.0 | G15: SUM(RC[-5]:RC[-1]) -> 13000.0
A16: Appleby Global Services Cayman Limited | B16: 0.0 | C16: 2451.4 | D16: 4018.55 | E16: 0.0 | F16: 0.0 | G16: SUM(RC[-5]:RC[-1]) -> 6469.950000000001
A17: Arete Wealth, Inc. | B17: 0.0 | C17: 8538.54 | D17: 0.0 | E17: 0.0 | F17: 0.0 | G17: SUM(RC[-5]:RC[-1]) -> 8538.54
A18: AudiencePoint Inc | B18: 0.0 | C18: 7000.0 | D18: 0.0 | E18: 0.0 | F18: 0.0 | G18: SUM(RC[-5]:RC[-1]) -> 7000.0
A19: Barrington Media Group LLC | B19: 0.0 | C19: 12817.25 | D19: 0.0 | E19: 0.0 | F19: 0.0 | G19: SUM(RC[-5]:RC[-1]) -> 12817.25
A20: Become Group SC | B20: 0.0 | C20: 3500.0 | D20: 0.0 | E20: 0.0 | F20: 0.0 | G20: SUM(RC[-5]:RC[-1]) -> 3500.0
A21: BEN HAMOU BENCHETRIT LAW GROUP | B21: 0.0 | C21: 8054.0 | D21: 0.0 | E21: 0.0 | F21: 0.0 | G21: SUM(RC[-5]:RC[-1]) -> 8054.0
A22: Citrin Cooperman & Company, LLP | B22: 0.0 | C22: 29400.0 | D22: 0.0 | E22: 0.0 | F22: 0.0 | G22: SUM(RC[-5]:RC[-1]) -> 29400.0
A23: Clevertech Partners LLC | B23: 0.0 | C23: 159000.0 | D23: 0.0 | E23: 0.0 | F23: 0.0 | G23: SUM(RC[-5]:RC[-1]) -> 159000.0
A24: Corporate Essentials | B24: 460.54 | C24: 0.0 | D24: 0.0 | E24: 0.0 | F24: 0.0 | G24: SUM(RC[-5]:RC[-1]) -> 460.54
A25: Delaware Freeport LLC | B25: 0.0 | C25: 8802.48 | D25: 0.0 | E25: 0.0 | F25: 0.0 | G25: SUM(RC[-5]:RC[-1]) -> 8802.48
A26: Dwolla | B26: 0.0 | C26: 0.0 | D26: 4500.0 | E26: 0.0 | F26: 0.0 | G26: SUM(RC[-5]:RC[-1]) -> 4500.0
A27: Elephant Ventures | B27: 0.0 | C27: 9500.0 | D27: 0.0 | E27: 0.0 | F27: 0.0 | G27: SUM(RC[-5]:RC[-1]) -> 9500.0
A28: Ericnomics LLC | B28: 0.0 | C28: 2500.0 | D28: 0.0 | E28: 0.0 | F28: 0.0 | G28: SUM(RC[-5]:RC[-1]) -> 2500.0
A29: Faved LTD | B29: 0.0 | C29: 500.0 | D29: 0.0 | E29: 0.0 | F29: 0.0 | G29: SUM(RC[-5]:RC[-1]) -> 500.0
A30: Gabriel Bult | B30: 0.0 | C30: 5500.0 | D30: 0.0 | E30: 0.0 | F30: 0.0 | G30: SUM(RC[-5]:RC[-1]) -> 5500.0
A31: Going | B31: 0.0 | C31: 6000.0 | D31: 0.0 | E31: 0.0 | F31: 0.0 | G31: SUM(RC[-5]:RC[-1]) -> 6000.0
A32: Google | B32: 5652.08 | C32: 0.0 | D32: 0.0 | E32: 0.0 | F32: 0.0 | G32: SUM(RC[-5]:RC[-1]) -> 5652.08
A33: GUARDD, Inc. | B33: 4000.0 | C33: 0.0 | D33: 92750.0 | E33: 0.0 | F33: 0.0 | G33: SUM(RC[-5]:RC[-1]) -> 96750.0
A34: Howard Media LLC | B34: 0.0 | C34: 0.0 | D34: -2000.0 | E34: 0.0 | F34: 2000.0 | G34: SUM(RC[-5]:RC[-1]) -> 0.0
A35: IC - Level & Co Gallery, LLC | B35: 0.0 | C35: 0.0 | D35: 175000.0 | E35: 0.0 | F35: 720020.74 | G35: SUM(RC[-5]:RC[-1]) -> 895020.74
A36: IC - Masterworks Advisers, LLC | B36: 0.0 | C36: 0.0 | D36: 0.0 | E36: 0.0 | F36: 60000.0 | G36: SUM(RC[-5]:RC[-1]) -> 60000.0
A37: IC - Masterworks Executive Services, LLC | B37: 0.0 | C37: 139394.15 | D37: 146144.02 | E37: 181440.72 | F37: 2568532.99 | G37: SUM(RC[-5]:RC[-1]) -> 3035511.8800000004
A38: IC - Masterworks Foundry, LLC | B38: 0.0 | C38: 0.0 | D38: 422176.21 | E38: 0.0 | F38: 119831.48 | G38: SUM(RC[-5]:RC[-1]) -> 542007.6900000001
A39: IC - Masterworks Gallery, LLC | B39: 0.0 | C39: 1100000.0 | D39: 1475000.0 | E39: 1900002.0 | F39: 4.160690494E7 | G39: SUM(RC[-5]:RC[-1]) -> 4.608190694E7
A40: IC - Masterworks Investor Services, LLC | B40: 0.0 | C40: 0.0 | D40: 0.0 | E40: 0.0 | F40: 30000.0 | G40: SUM(RC[-5]:RC[-1]) -> 30000.0
A41: IC - Masterworks, LLC | B41: 0.0 | C41: 0.0 | D41: 604294.6 | E41: 2.509151128E7 | F41: 2.495273077E7 | G41: SUM(RC[-5]:RC[-1]) -> 5.0648536650000006E7
A42: IC - MWG Cayman Entity | B42: 0.0 | C42: 0.0 | D42: 0.0 | E42: 35.52 | F42: 0.0 | G42: SUM(RC[-5]:RC[-1]) -> 35.52
A43: IC - Sierra 1 LLC | B43: 0.0 | C43: 0.0 | D43: 0.0 | E43: 0.0 | F43: 127023.98 | G43: SUM(RC[-5]:RC[-1]) -> 127023.98
A44: Impact Tech, Inc. | B44: 0.0 | C44: 18925.5 | D44: 0.0 | E44: 0.0 | F44: 0.0 | G44: SUM(RC[-5]:RC[-1]) -> 18925.5
A45: Influint | B45: 0.0 | C45: 4500.0 | D45: 0.0 | E45: 0.0 | F45: 0.0 | G45: SUM(RC[-5]:RC[-1]) -> 4500.0
A46: Jay Grimm | B46: 0.0 | C46: 762.5 | D46: 0.0 | E46: 0.0 | F46: 0.0 | G46: SUM(RC[-5]:RC[-1]) -> 762.5
A47: Jellyfish US Limited | B47: 0.0 | C47: 0.0 | D47: 0.0 | E47: 3395.21 | F47: 6798.75 | G47: SUM(RC[-5]:RC[-1]) -> 10193.96
A48: Jennifer Yum Ramp | B48: 0.0 | C48: 0.0 | D48: 0.0 | E48: 39.82 | F48: 0.0 | G48: SUM(RC[-5]:RC[-1]) -> 39.82
A49: Julia Nagle Conservation LTD | B49: 1037.97 | C49: 0.0 | D49: 0.0 | E49: 0.0 | F49: 0.0 | G49: SUM(RC[-5]:RC[-1]) -> 1037.97
A50: Julian Amaya | B50: 0.0 | C50: 2500.0 | D50: 0.0 | E50: 0.0 | F50: 0.0 | G50: SUM(RC[-5]:RC[-1]) -> 2500.0
A51: K&L Gates LLP | B51: 0.0 | C51: 3875.7 | D51: 29807.25 | E51: 0.0 | F51: 0.0 | G51: SUM(RC[-5]:RC[-1]) -> 33682.95
A52: Lakeshore IT Solutions | B52: 11272.09 | C52: 35890.45 | D52: 0.0 | E52: 0.0 | F52: 0.0 | G52: SUM(RC[-5]:RC[-1]) -> 47162.53999999999
A53: LexisNexis | B53: 413.73 | C53: 413.73 | D53: 0.0 | E53: 0.0 | F53: 0.0 | G53: SUM(RC[-5]:RC[-1]) -> 827.46
A54: LinkedIn Corporation | B54: 0.0 | C54: 0.0 | D54: 27004.53 | E54: 0.0 | F54: 0.0 | G54: SUM(RC[-5]:RC[-1]) -> 27004.53
A55: Mailgun Technologies, Inc. | B55: 0.0 | C55: 256.94 | D55: 0.0 | E55: 0.0 | F55: 0.0 | G55: SUM(RC[-5]:RC[-1]) -> 256.94
A56: Mango Technologies, Inc. | B56: 9720.36 | C56: 0.0 | D56: 0.0 | E56: 0.0 | F56: 0.0 | G56: SUM(RC[-5]:RC[-1]) -> 9720.36
A57: Media Intercept Inc | B57: 0.0 | C57: 13405.0 | D57: 0.0 | E57: 0.0 | F57: 0.0 | G57: SUM(RC[-5]:RC[-1]) -> 13405.0
A58: Nano Zebra Corp | B58: 3000.0 | C58: 0.0 | D58: 0.0 | E58: 0.0 | F58: 0.0 | G58: SUM(RC[-5]:RC[-1]) -> 3000.0
A59: Naoyoshi Mori | B59: 0.0 | C59: 0.0 | D59: -998.0 | E59: 0.0 | F59: 998.0 | G59: SUM(RC[-5]:RC[-1]) -> 0.0
A60: Onfido, Inc. | B60: 0.0 | C60: 3674.54 | D60: 0.0 | E60: 0.0 | F60: 0.0 | G60: SUM(RC[-5]:RC[-1]) -> 3674.54
A61: Pest Control Office Ltd | B61: 0.0 | C61: 59.85 | D61: 0.0 | E61: 0.0 | F61: 0.0 | G61: SUM(RC[-5]:RC[-1]) -> 59.85
A62: Plaid | B62: 0.0 | C62: 859.45 | D62: 0.0 | E62: 0.0 | F62: 0.0 | G62: SUM(RC[-5]:RC[-1]) -> 859.45
A63: Plaid Financial Ltd. | B63: 0.0 | C63: 658.96 | D63: 640.88 | E63: 0.0 | F63: -640.88 | G63: SUM(RC[-5]:RC[-1]) -> 658.9600000000002
A64: Quantum Leading, Inc. | B64: 0.0 | C64: 0.0 | D64: 5000.0 | E64: 0.0 | F64: 0.0 | G64: SUM(RC[-5]:RC[-1]) -> 5000.0
A65: Ropes & Gray LLP | B65: 0.0 | C65: 4730.0 | D65: 0.0 | E65: 0.0 | F65: 0.0 | G65: SUM(RC[-5]:RC[-1]) -> 4730.0
A66: SiriusXM | B66: 0.0 | C66: 0.0 | D66: 0.0 | E66: 0.0 | F66: 3000.0 | G66: SUM(RC[-5]:RC[-1]) -> 3000.0
A67: Stoic Media LTD | B67: 0.0 | C67: 0.0 | D67: 1000.0 | E67: 0.0 | F67: 0.0 | G67: SUM(RC[-5]:RC[-1]) -> 1000.0
A68: Striano Electric | B68: 0.0 | C68: 4071.93 | D68: 0.0 | E68: 0.0 | F68: 0.0 | G68: SUM(RC[-5]:RC[-1]) -> 4071.93
A69: TabaPay | B69: 0.0 | C69: 792.1 | D69: 0.0 | E69: 0.0 | F69: 69675.61 | G69: SUM(RC[-5]:RC[-1]) -> 70467.71
A70: Till Musshoff | B70: 0.0 | C70: 0.0 | D70: -2.7 | E70: 0.0 | F70: 2.7 | G70: SUM(RC[-5]:RC[-1]) -> 0.0
A71: Tinuiti, Inc. | B71: 0.0 | C71: 0.0 | D71: 50000.0 | E71: 0.0 | F71: 0.0 | G71: SUM(RC[-5]:RC[-1]) -> 50000.0
A72: TriplePoint Capital LLC | B72: 0.0 | C72: 99027.78 | D72: 0.0 | E72: 0.0 | F72: 0.0 | G72: SUM(RC[-5]:RC[-1]) -> 99027.78
A73: Twilio | B73: 12414.13 | C73: 0.0 | D73: 0.0 | E73: 0.0 | F73: 0.0 | G73: SUM(RC[-5]:RC[-1]) -> 12414.13
A74: UOVO LLC | B74: 0.0 | C74: 4623.1 | D74: 0.0 | E74: 0.0 | F74: 0.0 | G74: SUM(RC[-5]:RC[-1]) -> 4623.1
A75: Validity Inc | B75: 0.0 | C75: 9542.38 | D75: 0.0 | E75: 0.0 | F75: 0.0 | G75: SUM(RC[-5]:RC[-1]) -> 9542.38
A76: VPS Services, LLC | B76: 3500.0 | C76: 5995.06 | D76: 0.0 | E76: 0.0 | F76: 0.0 | G76: SUM(RC[-5]:RC[-1]) -> 9495.060000000001
A77: WFP TOWER B CO. L.P. | B77: 0.0 | C77: 251585.83 | D77: 0.0 | E77: 0.0 | F77: 0.0 | G77: SUM(RC[-5]:RC[-1]) -> 251585.83
A78: Total - Vendor | B78: SUM(R[-67]C:R[-1]C) -> 83496.22 | C78: SUM(R[-67]C:R[-1]C) -> 1986332.3800000001 | D78: SUM(R[-67]C:R[-1]C) -> 3034335.34 | E78: SUM(R[-67]C:R[-1]C) -> 2.717642455E7 | F78: SUM(R[-67]C:R[-1]C) -> 7.026687908000001E7 | G78: SUM(R[-67]C:R[-1]C) -> 1.0254746757000002E8
A79: Total | B79: SUM(R[-70]C,R[-1]C) -> 83496.22 | C79: SUM(R[-70]C,R[-1]C) -> 1986332.3800000001 | D79: SUM(R[-70]C,R[-1]C) -> 3034335.34 | E79: SUM(R[-70]C,R[-1]C) -> 2.717642455E7 | F79: SUM(R[-70]C,R[-1]C) -> 1.5850725021E8 | G79: SUM(R[-70]C,R[-1]C) -> 1.9078783870000002E8